{
  "schemaVersion": 1,
  "exportedAt": "2026-08-01T00:00:00Z",
  "source": "pwa-0.6-example",
  "account": {
    "meta": {
      "teamLevel": 1,
      "budget": 20,
      "glyphRunes": 0,
      "artifactResources": 0,
      "skinStones": 0,
      "titanPotions": 0
    },
    "heroes": {
      "Astaroth": {
        "level": 1,
        "stars": 1,
        "glyphs": {
          "Rüstung": 0,
          "Gesundheit": 0,
          "Stärke": 0,
          "Magieverteidigung": 0,
          "Magischer Angriff": 0
        },
        "artifacts": {
          "Waffe": 1,
          "Buch": 1,
          "Ring": 1
        },
        "skins": {
          "Standard": 1,
          "Donner": 1,
          "Barbar": 1
        },
        "enabled": false
      },
      "Dante": {
        "level": 1,
        "stars": 1,
        "glyphs": {
          "Physischer Angriff": 0,
          "Rüstungsdurchdringung": 0,
          "Beweglichkeit": 0,
          "Gesundheit": 0,
          "Rüstung": 0
        },
        "artifacts": {
          "Waffe": 1,
          "Buch": 1,
          "Ring": 1
        },
        "skins": {
          "Standard": 1,
          "Winter": 1,
          "Solar": 1
        },
        "enabled": false
      },
      "Jorgen": {
        "level": 1,
        "stars": 1,
        "glyphs": {
          "Gesundheit": 0,
          "Rüstung": 0,
          "Magieverteidigung": 0,
          "Magischer Angriff": 0,
          "Ausweichen": 0
        },
        "artifacts": {
          "Waffe": 1,
          "Buch": 1,
          "Ring": 1
        },
        "skins": {
          "Standard": 1,
          "Champion": 1
        },
        "enabled": false
      },
      "Folio": {
        "level": 1,
        "stars": 1,
        "glyphs": {
          "Magischer Angriff": 0,
          "Intelligenz": 0,
          "Gesundheit": 0,
          "Magieverteidigung": 0,
          "Rüstung": 0
        },
        "artifacts": {
          "Waffe": 1,
          "Buch": 1,
          "Ring": 1
        },
        "skins": {
          "Standard": 1,
          "Dämon": 1
        },
        "enabled": false
      },
      "Maya": {
        "level": 1,
        "stars": 1,
        "glyphs": {
          "Gesundheit": 0,
          "Magischer Angriff": 0,
          "Intelligenz": 0,
          "Magieverteidigung": 0,
          "Rüstung": 0
        },
        "artifacts": {
          "Waffe": 1,
          "Buch": 1,
          "Ring": 1
        },
        "skins": {
          "Standard": 1,
          "Winter": 1
        },
        "enabled": false
      },
      "Octavia": {
        "level": 1,
        "stars": 1,
        "glyphs": {
          "Gesundheit": 0,
          "Ausweichen": 0,
          "Beweglichkeit": 0,
          "Magieverteidigung": 0,
          "Rüstung": 0
        },
        "artifacts": {
          "Waffe": 1,
          "Buch": 1,
          "Ring": 1
        },
        "skins": {
          "Standard": 1
        },
        "enabled": false
      },
      "Fafnir": {
        "level": 1,
        "stars": 1,
        "glyphs": {
          "Gesundheit": 0,
          "Stärke": 0,
          "Magieverteidigung": 0,
          "Rüstung": 0,
          "Physischer Angriff": 0
        },
        "artifacts": {
          "Waffe": 1,
          "Buch": 1,
          "Ring": 1
        },
        "skins": {
          "Standard": 1
        },
        "enabled": false
      },
      "Gesichtsloser": {
        "level": 1,
        "stars": 1,
        "glyphs": {
          "Magischer Angriff": 0,
          "Gesundheit": 0,
          "Intelligenz": 0,
          "Magieverteidigung": 0,
          "Rüstung": 0
        },
        "artifacts": {
          "Waffe": 1,
          "Buch": 1,
          "Ring": 1
        },
        "skins": {
          "Standard": 1
        },
        "enabled": false
      },
      "Ginger": {
        "level": 1,
        "stars": 1,
        "glyphs": {
          "Physischer Angriff": 0,
          "Beweglichkeit": 0,
          "Rüstungsdurchdringung": 0,
          "Gesundheit": 0,
          "Rüstung": 0
        },
        "artifacts": {
          "Waffe": 1,
          "Buch": 1,
          "Ring": 1
        },
        "skins": {
          "Standard": 1
        },
        "enabled": false
      },
      "Galahad": {
        "level": 1,
        "stars": 1,
        "glyphs": {
          "Rüstung": 0,
          "Gesundheit": 0,
          "Stärke": 0,
          "Physischer Angriff": 0,
          "Magieverteidigung": 0
        },
        "artifacts": {
          "Waffe": 1,
          "Buch": 1,
          "Ring": 1
        },
        "skins": {
          "Standard": 1
        },
        "enabled": false
      },
      "Thea": {
        "level": 1,
        "stars": 1,
        "glyphs": {
          "Gesundheit": 0,
          "Magischer Angriff": 0,
          "Intelligenz": 0,
          "Magieverteidigung": 0,
          "Rüstung": 0
        },
        "artifacts": {
          "Waffe": 1,
          "Buch": 1,
          "Ring": 1
        },
        "skins": {
          "Standard": 1
        },
        "enabled": false
      },
      "Jhu": {
        "level": 1,
        "stars": 1,
        "glyphs": {
          "Physischer Angriff": 0,
          "Gesundheit": 0,
          "Beweglichkeit": 0,
          "Rüstungsdurchdringung": 0,
          "Rüstung": 0
        },
        "artifacts": {
          "Waffe": 1,
          "Buch": 1,
          "Ring": 1
        },
        "skins": {
          "Standard": 1
        },
        "enabled": false
      },
      "Morrigan": {
        "level": 1,
        "stars": 1,
        "glyphs": {
          "Gesundheit": 0,
          "Magischer Angriff": 0,
          "Intelligenz": 0,
          "Magieverteidigung": 0,
          "Rüstung": 0
        },
        "artifacts": {
          "Waffe": 1,
          "Buch": 1,
          "Ring": 1
        },
        "skins": {
          "Standard": 1
        },
        "enabled": false
      },
      "Aurora": {
        "level": 1,
        "stars": 1,
        "glyphs": {
          "Ausweichen": 0,
          "Gesundheit": 0,
          "Magieverteidigung": 0,
          "Rüstung": 0,
          "Stärke": 0
        },
        "artifacts": {
          "Waffe": 1,
          "Buch": 1,
          "Ring": 1
        },
        "skins": {
          "Standard": 1
        },
        "enabled": false
      },
      "Artemis": {
        "level": 1,
        "stars": 1,
        "glyphs": {
          "Physischer Angriff": 0,
          "Beweglichkeit": 0,
          "Rüstungsdurchdringung": 0,
          "Gesundheit": 0,
          "Rüstung": 0
        },
        "artifacts": {
          "Waffe": 1,
          "Buch": 1,
          "Ring": 1
        },
        "skins": {
          "Standard": 1
        },
        "enabled": false
      },
      "Phobos": {
        "level": 1,
        "stars": 1,
        "glyphs": {
          "Magischer Angriff": 0,
          "Intelligenz": 0,
          "Gesundheit": 0,
          "Magieverteidigung": 0,
          "Rüstung": 0
        },
        "artifacts": {
          "Waffe": 1,
          "Buch": 1,
          "Ring": 1
        },
        "skins": {
          "Standard": 1
        },
        "enabled": false
      }
    },
    "titans": {
      "Sigurd": {
        "level": 1,
        "stars": 1,
        "skins": {
          "Standard": 1,
          "Ur": 1
        },
        "artifacts": {
          "Waffe": 1,
          "Krone": 1,
          "Siegel": 1
        },
        "enabled": false
      },
      "Iyari": {
        "level": 1,
        "stars": 1,
        "skins": {
          "Standard": 1,
          "Ur": 1
        },
        "artifacts": {
          "Waffe": 1,
          "Krone": 1,
          "Siegel": 1
        },
        "enabled": false
      },
      "Nova": {
        "level": 1,
        "stars": 1,
        "skins": {
          "Standard": 1,
          "Ur": 1
        },
        "artifacts": {
          "Waffe": 1,
          "Krone": 1,
          "Siegel": 1
        },
        "enabled": false
      },
      "Eden": {
        "level": 1,
        "stars": 1,
        "skins": {
          "Standard": 1
        },
        "artifacts": {
          "Waffe": 1,
          "Krone": 1,
          "Siegel": 1
        },
        "enabled": false
      },
      "Moloch": {
        "level": 1,
        "stars": 1,
        "skins": {
          "Standard": 1
        },
        "artifacts": {
          "Waffe": 1,
          "Krone": 1,
          "Siegel": 1
        },
        "enabled": false
      },
      "Keros": {
        "level": 1,
        "stars": 1,
        "skins": {
          "Standard": 1
        },
        "artifacts": {
          "Waffe": 1,
          "Krone": 1,
          "Siegel": 1
        },
        "enabled": false
      },
      "Avalon": {
        "level": 1,
        "stars": 1,
        "skins": {
          "Standard": 1
        },
        "artifacts": {
          "Waffe": 1,
          "Krone": 1,
          "Siegel": 1
        },
        "enabled": false
      },
      "Sylva": {
        "level": 1,
        "stars": 1,
        "skins": {
          "Standard": 1
        },
        "artifacts": {
          "Waffe": 1,
          "Krone": 1,
          "Siegel": 1
        },
        "enabled": false
      },
      "Mairi": {
        "level": 1,
        "stars": 1,
        "skins": {
          "Standard": 1
        },
        "artifacts": {
          "Waffe": 1,
          "Krone": 1,
          "Siegel": 1
        },
        "enabled": false
      },
      "Ignis": {
        "level": 1,
        "stars": 1,
        "skins": {
          "Standard": 1
        },
        "artifacts": {
          "Waffe": 1,
          "Krone": 1,
          "Siegel": 1
        },
        "enabled": false
      },
      "Vulcan": {
        "level": 1,
        "stars": 1,
        "skins": {
          "Standard": 1
        },
        "artifacts": {
          "Waffe": 1,
          "Krone": 1,
          "Siegel": 1
        },
        "enabled": false
      }
    }
  }
}